{"benchmark_version":"dev-021-context-benchmark@1","certification_hash":"sha256:f0fc97c23351e0471540e8205dc2550ec52cf2b469e17d703653a8354efb34e7","certification_version":"context-benchmark-certification@1","certified":true,"context":{"benchmark_version":"dev-021-context-benchmark@1","budget_bytes":32000,"clock":"time.perf_counter_ns","context_rendered_bytes":2928,"context_sha256":"sha256:0e5eab709a65e259da89dd52f7b4867e7eed02d6a5e87640c954c451fabf5081","environment":{"platform":"macOS-15.0.1-arm64-arm-64bit-Mach-O","python":"3.13.2","sqlite":"3.45.3"},"latency":{"max_ns":1746296083,"median_ns":1322214687.0,"min_ns":1215714709,"p95_ns":1676788500,"sample_count":50},"metric":"warm-filesystem-library-context","p95_method":"nearest-rank","samples_ns":[1318867166,1332423583,1232916750,1676788500,1247872834,1261337708,1262057708,1306773584,1634479417,1235815791,1215714709,1484252583,1633193333,1302358708,1338903458,1302700875,1670818834,1223999750,1246964166,1280713958,1343079708,1540199583,1253285375,1295913625,1362148959,1298228208,1396929042,1219959625,1325562208,1445174666,1460861791,1418352334,1317360458,1219983333,1252020959,1629298333,1228414292,1427062209,1553675917,1746296083,1455852875,1378609583,1264941583,1701818708,1453144709,1298922958,1263121458,1576076334,1377675208,1249400958],"target_met":true,"target_p95_ns":2000000000,"warmup_count":5},"databases":{"replay":{"sha256":"sha256:294887c8227dc98a57862c08a32e2de7baccd689c61d6de927c4beabd60223f2","size_bytes":527572992},"source":{"sha256":"sha256:5b750ef754c7483ce58fc12cc7ed69ff0064007625b4436cf61e809781305446","size_bytes":527572992}},"environment":{"platform":"macOS-15.0.1-arm64-arm-64bit-Mach-O","python":"3.13.2","sqlite":"3.45.3"},"fixture":{"fixture_version":"dev-021-fixture@1","generation_api":"Kernel.commit","head_entry_hash":"sha256:6c326ebda69559d4dae0194051c641ec3418122b1f922980109b539920aeef48","hot_object":{"history_entries":100000,"object_id":"workitem_dev021_hot_00000090","object_type":"WORK_ITEM","status":"DOING"},"ledger_entries":100000,"manifest_hash":"sha256:22913a87fc846551f1aa4d1f73c303aad460fffa1a5a80a798a3f552a98f8cbe","profile":"hot-active","projection_version":"markdown-projection@3","schema_version":"1.3.0","seed":90,"state_root":"sha256:2558621be1d7149991dfcfb9416ddd6466d75d00d080aedc11adba37b6abfc0f","table_counts":{"claims":0,"conflicts":0,"decision_records":0,"evidence":0,"ledger":100000,"open_questions":0,"receipts":100000,"sources":0,"work_items":1}},"fixture_version":"dev-021-fixture@1","implementation_id":"c84e9e6","profile":"hot-active","projection_version":"markdown-projection@3","replay":{"parity":true,"source":{"head_hash":"sha256:6c326ebda69559d4dae0194051c641ec3418122b1f922980109b539920aeef48","head_sequence":100000,"ledger_count":100000,"receipt_count":100000,"receipt_schema_versions":["1.3.0"],"state_root":"sha256:2558621be1d7149991dfcfb9416ddd6466d75d00d080aedc11adba37b6abfc0f"},"target":{"head_hash":"sha256:6c326ebda69559d4dae0194051c641ec3418122b1f922980109b539920aeef48","head_sequence":100000,"ledger_count":100000,"receipt_count":100000,"receipt_schema_versions":["1.3.0"],"state_root":"sha256:2558621be1d7149991dfcfb9416ddd6466d75d00d080aedc11adba37b6abfc0f"}},"requested_ledger_entries":100000,"schema_version":"1.3.0","timings_ns":{"context":76258312208,"generation":249858223250,"replay":259421285500,"verification":479836373542},"verification":{"checked_entries":100000,"errors":[],"head_hash":"sha256:6c326ebda69559d4dae0194051c641ec3418122b1f922980109b539920aeef48","state_root":"sha256:2558621be1d7149991dfcfb9416ddd6466d75d00d080aedc11adba37b6abfc0f","valid":true}}
