{"benchmark_version":"dev-021-context-benchmark@1","certification_hash":"sha256:b9e2e01842f05db1bf432f68e2b7586e809d9c0c25b944b4b7608e144e5fc3a9","certification_version":"context-benchmark-certification@1","certified":true,"context":{"benchmark_version":"dev-021-context-benchmark@1","budget_bytes":32000,"clock":"time.perf_counter_ns","context_rendered_bytes":950,"context_sha256":"sha256:9e765898693b0132de629c615a7b2d54324629fef5a43cfe1286b6b0c674d882","environment":{"platform":"macOS-15.0.1-arm64-arm-64bit-Mach-O","python":"3.13.2","sqlite":"3.45.3"},"latency":{"max_ns":6671417,"median_ns":2125271.0,"min_ns":1628500,"p95_ns":4716500,"sample_count":50},"metric":"warm-filesystem-library-context","p95_method":"nearest-rank","samples_ns":[2358000,2210208,1936000,2280375,2443000,1765833,1931625,1994167,1797875,1628500,1664083,2612959,3318542,3154625,2419959,2569125,2292500,1893042,3229375,6085000,6671417,4716500,3348000,2457750,1840708,2053250,2054708,2139375,1958000,1857000,1716125,2054417,2351875,1878000,2032750,2264541,1954375,1900167,1955708,2610625,2790500,1957500,2111167,2432583,2923750,2342958,2210125,2084625,1632833,1711417],"target_met":true,"target_p95_ns":2000000000,"warmup_count":5},"databases":{"replay":{"sha256":"sha256:6a1af3357aeb1f0a29135f1fcd592b74deb3ca4f77fe7700ac7deacd02adab55","size_bytes":527507456},"source":{"sha256":"sha256:d0bbaaeb0441b7fa58bea99e01eb04ba5728377085e30244905a8fb0b8cbfddc","size_bytes":527507456}},"environment":{"platform":"macOS-15.0.1-arm64-arm-64bit-Mach-O","python":"3.13.2","sqlite":"3.45.3"},"fixture":{"fixture_version":"dev-021-fixture@1","generation_api":"Kernel.commit","head_entry_hash":"sha256:74ca3374a22bb05e63cec1f5f7795a689a55761917d0993803bd4bc8a17b0243","hot_object":{"history_entries":100000,"object_id":"workitem_dev021_hot_00000089","object_type":"WORK_ITEM","status":"DONE"},"ledger_entries":100000,"manifest_hash":"sha256:1abe3c4ff6ee5f98a043c6dfcd54ae49ef9be22859918732f766cb99a0ea9ddb","profile":"history-heavy","projection_version":"markdown-projection@3","schema_version":"1.3.0","seed":89,"state_root":"sha256:766151b97dfbc5fa5f250e7d4e44d8477d641f4102e2170c357fca81694f94eb","table_counts":{"claims":0,"conflicts":0,"decision_records":0,"evidence":0,"ledger":100000,"open_questions":0,"receipts":100000,"sources":0,"work_items":1}},"fixture_version":"dev-021-fixture@1","implementation_id":"c84e9e6","profile":"history-heavy","projection_version":"markdown-projection@3","replay":{"parity":true,"source":{"head_hash":"sha256:74ca3374a22bb05e63cec1f5f7795a689a55761917d0993803bd4bc8a17b0243","head_sequence":100000,"ledger_count":100000,"receipt_count":100000,"receipt_schema_versions":["1.3.0"],"state_root":"sha256:766151b97dfbc5fa5f250e7d4e44d8477d641f4102e2170c357fca81694f94eb"},"target":{"head_hash":"sha256:74ca3374a22bb05e63cec1f5f7795a689a55761917d0993803bd4bc8a17b0243","head_sequence":100000,"ledger_count":100000,"receipt_count":100000,"receipt_schema_versions":["1.3.0"],"state_root":"sha256:766151b97dfbc5fa5f250e7d4e44d8477d641f4102e2170c357fca81694f94eb"}},"requested_ledger_entries":100000,"schema_version":"1.3.0","timings_ns":{"context":261523667,"generation":243340542000,"replay":257701622625,"verification":475293815833},"verification":{"checked_entries":100000,"errors":[],"head_hash":"sha256:74ca3374a22bb05e63cec1f5f7795a689a55761917d0993803bd4bc8a17b0243","state_root":"sha256:766151b97dfbc5fa5f250e7d4e44d8477d641f4102e2170c357fca81694f94eb","valid":true}}
